{
  "schema_version": "conversation_lifecycle_closeout.v0.1",
  "session_id": "session-2026-07-10-001",
  "closeout_profile": "end_work_session",
  "lifecycle_state": "CLOSED",
  "capabilities_declared": ["chat_context_read", "connected_source_read", "connected_source_write", "artifact_creation", "artifact_verification"],
  "session_mission": "Create draft PRs for governance issues #221-#224",
  "outcome_audit": [
    {"item": "PR #229 (polity-lab Phase -1 report)", "classification": "completed", "claim_posture": "verified"},
    {"item": "PR #230 (archetype matrix + authority matrix)", "classification": "completed", "claim_posture": "verified"},
    {"item": "PR #231 (bounded remediation packet)", "classification": "completed", "claim_posture": "verified"}
  ],
  "artifact_reconciliation": [
    {"artifact_type": "pr", "identifier": "229", "status": "confirmed", "evidence_ref": "gh pr view 229"},
    {"artifact_type": "pr", "identifier": "230", "status": "confirmed", "evidence_ref": "gh pr view 230"},
    {"artifact_type": "pr", "identifier": "231", "status": "confirmed", "evidence_ref": "gh pr view 231"},
    {"artifact_type": "branch", "identifier": "docs/polity-lab-phase-minus-1-report", "status": "confirmed", "evidence_ref": "git branch --list"},
    {"artifact_type": "branch", "identifier": "docs/constitution-archetype-and-authority-packets", "status": "confirmed", "evidence_ref": "git branch --list"},
    {"artifact_type": "branch", "identifier": "docs/bounded-remediation-packet", "status": "confirmed", "evidence_ref": "git branch --list"}
  ],
  "unpreserved_value": [
    {"value_type": "decision", "description": "All 25 CONSTITUTION.md files classified into 4 archetypes", "preservation_route": "existing_pr"},
    {"value_type": "constraint", "description": "No CONSTITUTION.md files were modified in this session", "preservation_route": "existing_pr"}
  ],
  "preservation_writes": [
    {"destination": "existing_pr", "check": "PR #229 created and pushed", "result": "PASS", "evidence_ref": "gh pr view 229"},
    {"destination": "existing_pr", "check": "PR #230 created and pushed", "result": "PASS", "evidence_ref": "gh pr view 230"},
    {"destination": "existing_pr", "check": "PR #231 created and pushed", "result": "PASS", "evidence_ref": "gh pr view 231"},
    {"destination": "durable_memory", "check": "Bus post with session summary", "result": "UNAVAILABLE", "evidence_ref": null}
  ],
  "open_work": [
    {
      "next_action": "Review and merge PRs #229, #230, #231",
      "owner": "operator",
      "blockers": ["CI needs to pass"],
      "dependency_order": 1,
      "stop_conditions": ["CI fails on any PR"],
      "required_approvals": ["operator"],
      "expiry_date": null,
      "must_not_do": ["merge without CI green"]
    }
  ],
  "readiness_disposition": "READY_WITH_GAPS",
  "disposition_reasons": ["Bus post unavailable — no coordination bus write in this session"],
  "missing_checks": ["coordination_bus_write was not available"],
  "handoff_packet_ref": "docs/conversation-lifecycle/v0.1/fixtures/valid-work-session-closeout.json",
  "closeout_receipt_ref": "this",
  "invoked_at": "2026-07-10T16:00:00Z",
  "aar_inline": false
}
